{
  "schema": "witsoc.kernel-state.v1",
  "kernel_id": "WK-example",
  "genesis": {},
  "target": {
    "statement": "A synthetic frozen target.",
    "intent": "exercise the packet shape",
    "constraints": [],
    "content_sha256": "0000000000000000000000000000000000000000000000000000000000000000",
    "canonical_sha256": "0000000000000000000000000000000000000000000000000000000000000000"
  },
  "mode": "OPEN_DISCOVERY",
  "domains": ["example"],
  "ceiling": "SKETCH",
  "revision": 0,
  "previous_state_sha256": null,
  "status": "OPEN",
  "outcome": "OPEN",
  "frontier": {},
  "evidence": [],
  "decisions": [],
  "route_attempts": [],
  "pending_episode": null,
  "frame_projection": null,
  "events": [],
  "state_sha256": "0000000000000000000000000000000000000000000000000000000000000000"
}
